Sheet: Sheet1
A1: Course | B1: Requirement | C1: Units
A2: City College (70 Units)
B3: All credits | C3: 70
A4: Fall 2013 - Semester 1 | C4: =SUM(R[1]C) -> 3
A5: CSC 210 | B5: Introduction to Computer Programming (Supporting Lab CSC 211 Recommended — 1 Unit) | C5: 3
A6: Spring 2014 – Semester 2 | C6: =SUM(R[1]C:R[4]C) -> 12
A7: CSC 220 | B7: Data Structures | C7: 3
A8: PHYS 220/222 | B8: GE 2 Physical/Biological Sciences: General Physics with Calculus I | C8: 3
A9: CSC 230 | B9: Discrete Mathematical Structures for Computer Science | C9: 3
A10: CSC 300 GW | B10: Ethics, Software, and Communications (GWAR) | C10: 3
A11: Fall 2014 - Semester 3 | C11: =SUM(R[1]C:R[5]C) -> 16
A12: CSC 256 | B12: Machine Structures | C12: 3
A13: Various Options | B13: GE 3 Cluster | C13: 3
A14: Various Options | B14: GE 3 Cluster | C14: 3
A15: Various Options | B15: GE 3 Elective | C15: 3
A16: MATH 227 | B16: Calculus II | C16: 4
A17: Spring 2015 - Semester 4 | C17: =SUM(R[1]C:R[4]C) -> 13
A18: MATH 325 | B18: Linear Algebra | C18: 3
A19: MATH 324 | B19: Probability & Statistics with Computing | C19: 3
A20: PHYS 230/232 | B20: General Physics with Calculus II & Lab | C20: 4
A21: CSC 340 | B21: Programming Methodology | C21: 3
A22: Fall 2015 - Semester 5 | C22: =SUM(R[1]C:R[4]C) -> 12
A23: CSC 510 | B23: Analysis of Algorithms | C23: 3
A24: CSC 520 or 656 | B24: Theory of Computing or Computer Organization | C24: 3
A25: CSC 415 | B25: Operating Systems | C25: 3
A26: CSC 413 | B26: Software Development | C26: 3
A27: Spring 2016 - Semester 6 | C27: =SUM(R[1]C:R[5]C) -> 13
A28: CSC 412 | B28: Advanced Software Laboratory | C28: 1
A29: CSC 600 | B29: Programming Language Design | C29: 3
A30: CSC 520 or 656 | B30: Theory of Computing or Computer Organization | C30: 3
A31: CSC ELECTIVE | B31: Major Elective on Advisement (600+ Level CS Classes or Math 400) | C31: 3
A32: CSC 648 | B32: Software Engineering | C32: 3
C33: =SUM(R[-5]C:R[20]C,R[-10]C:R[13]C,R[-15]C:R[6]C,R[-26]C:R[-23]C,R[-28]C,R[-30]C) -> 147
A34: Units Required for Major: 71 | C34: 71
A35: Units Required for Degree: 120 | C35: 120